{
  "meta": {
    "schema_version": "inflection_compact.1",
    "trade_date": "2026-09-04",
    "as_of": "2026-09-04T15:05:00+08:00",
    "final_judgement_owner": "chatgpt"
  },
  "data_quality": {
    "status": "PARTIAL",
    "checks": [
      {
        "name": "scanner_nonempty",
        "actual": 5507,
        "threshold": 1,
        "passed": true
      },
      {
        "name": "core_feature_coverage",
        "actual": 0.9963682585799891,
        "threshold": 0.9,
        "passed": true
      },
      {
        "name": "full_250d_history_coverage",
        "actual": 0.9783911385509352,
        "threshold": 0.9,
        "passed": true
      },
      {
        "name": "turnover_feature_coverage",
        "actual": 0.0,
        "threshold": 0.9,
        "passed": false,
        "reason": "daily_basic unavailable"
      },
      {
        "name": "score_change_1d_coverage",
        "actual": 1.0,
        "threshold": 0.9,
        "passed": true,
        "reason": ""
      },
      {
        "name": "score_change_5d_coverage",
        "actual": 0.008897766479026693,
        "threshold": 0.9,
        "passed": false,
        "reason": "five-day full-market scan history is incomplete"
      },
      {
        "name": "score_change_20d_coverage",
        "actual": 0.008897766479026693,
        "threshold": 0.9,
        "passed": false,
        "reason": "twenty-day full-market scan history is incomplete"
      },
      {
        "name": "history_fetch_failures",
        "actual": 0,
        "threshold": 0,
        "passed": true
      },
      {
        "name": "fundamental_source_available",
        "actual": "AVAILABLE",
        "threshold": "AVAILABLE",
        "passed": true,
        "reason": ""
      }
    ],
    "fundamental_source": {
      "status": "AVAILABLE",
      "record_count": 53,
      "future_rejected": 0
    },
    "known_gaps": [
      "turnover_rate history unavailable because Tushare daily_basic is unavailable",
      "adjustment-factor history unavailable; price structure uses raw daily prices",
      "capacity_confirmation and breadth_confirmation are deferred to Phase I6",
      "positive_catalyst_fatigue requires multiple historical catalyst-response windows"
    ]
  },
  "top_new_inflections": [
    {
      "ts_code": "603444.SH",
      "stock_name": "吉比特",
      "industry": "互联网",
      "themes": [],
      "trend_inflection_score": 42,
      "fundamental_inflection_score": 0,
      "price_volume_score": 16,
      "daily_structure_score": 10,
      "weekly_trend_score": 8,
      "chip_structure_score": 8,
      "status": "INFLECTION_WATCH",
      "previous_status": "NO_SIGNAL",
      "score_change_1d": 31.0,
      "score_change_5d": null,
      "main_catalyst": null,
      "catalyst_stage": null,
      "evidence_level": null,
      "amount_ratio_20d": 2.318408719800034,
      "amount_percentile_120d": 97.5,
      "pullback_volume_ratio": null,
      "breakout_type": "BREAKOUT_60D",
      "breakout_hold_days": 1,
      "weekly_breakout_type": "WEEK_BREAKOUT_12W",
      "capacity_confirmation": null,
      "risk_flags": [],
      "why_selected": [
        "当日成交额为此前20日均值的2.32倍",
        "收盘价形成BREAKOUT_60D，站稳天数1",
        "周线形成WEEK_BREAKOUT_12W"
      ]
    },
    {
      "ts_code": "000702.SZ",
      "stock_name": "正虹科技",
      "industry": "饲料",
      "themes": [
        "饲料"
      ],
      "trend_inflection_score": 41,
      "fundamental_inflection_score": 0,
      "price_volume_score": 18,
      "daily_structure_score": 12,
      "weekly_trend_score": 3,
      "chip_structure_score": 8,
      "status": "INFLECTION_WATCH",
      "previous_status": "NO_SIGNAL",
      "score_change_1d": 31.0,
      "score_change_5d": null,
      "main_catalyst": null,
      "catalyst_stage": null,
      "evidence_level": null,
      "amount_ratio_20d": 3.051259433088695,
      "amount_percentile_120d": 96.66666666666667,
      "pullback_volume_ratio": null,
      "breakout_type": "BREAKOUT_60D",
      "breakout_hold_days": 1,
      "weekly_breakout_type": "WEEK_BREAKOUT_12W",
      "capacity_confirmation": null,
      "risk_flags": [],
      "why_selected": [
        "当日成交额为此前20日均值的3.05倍",
        "收盘价形成BREAKOUT_60D，站稳天数1",
        "周线形成WEEK_BREAKOUT_12W"
      ]
    },
    {
      "ts_code": "000058.SZ",
      "stock_name": "深赛格",
      "industry": "商品城",
      "themes": [],
      "trend_inflection_score": 41,
      "fundamental_inflection_score": 0,
      "price_volume_score": 18,
      "daily_structure_score": 12,
      "weekly_trend_score": 3,
      "chip_structure_score": 8,
      "status": "INFLECTION_WATCH",
      "previous_status": "NO_SIGNAL",
      "score_change_1d": 30.0,
      "score_change_5d": 5.0,
      "main_catalyst": null,
      "catalyst_stage": null,
      "evidence_level": null,
      "amount_ratio_20d": 3.2679031431091468,
      "amount_percentile_120d": 99.16666666666667,
      "pullback_volume_ratio": null,
      "breakout_type": "BREAKOUT_60D",
      "breakout_hold_days": 1,
      "weekly_breakout_type": "WEEK_BREAKOUT_12W",
      "capacity_confirmation": null,
      "risk_flags": [],
      "why_selected": [
        "当日成交额为此前20日均值的3.27倍",
        "收盘价形成BREAKOUT_60D，站稳天数1",
        "周线形成WEEK_BREAKOUT_12W"
      ]
    },
    {
      "ts_code": "603613.SH",
      "stock_name": "国联股份",
      "industry": "互联网电",
      "themes": [
        "互联网电"
      ],
      "trend_inflection_score": 41,
      "fundamental_inflection_score": 0,
      "price_volume_score": 18,
      "daily_structure_score": 12,
      "weekly_trend_score": 3,
      "chip_structure_score": 8,
      "status": "INFLECTION_WATCH",
      "previous_status": "NO_SIGNAL",
      "score_change_1d": 30.0,
      "score_change_5d": null,
      "main_catalyst": null,
      "catalyst_stage": null,
      "evidence_level": null,
      "amount_ratio_20d": 5.082164209377116,
      "amount_percentile_120d": 100.0,
      "pullback_volume_ratio": null,
      "breakout_type": "BREAKOUT_60D",
      "breakout_hold_days": 1,
      "weekly_breakout_type": "WEEK_BREAKOUT_12W",
      "capacity_confirmation": null,
      "risk_flags": [],
      "why_selected": [
        "当日成交额为此前20日均值的5.08倍",
        "收盘价形成BREAKOUT_60D，站稳天数1",
        "周线形成WEEK_BREAKOUT_12W"
      ]
    },
    {
      "ts_code": "603161.SH",
      "stock_name": "科华控股",
      "industry": "汽车零部",
      "themes": [
        "汽车零部"
      ],
      "trend_inflection_score": 52,
      "fundamental_inflection_score": 0,
      "price_volume_score": 18,
      "daily_structure_score": 13,
      "weekly_trend_score": 15,
      "chip_structure_score": 6,
      "status": "INFLECTION_CANDIDATE",
      "previous_status": "NO_SIGNAL",
      "score_change_1d": 29.0,
      "score_change_5d": null,
      "main_catalyst": null,
      "catalyst_stage": null,
      "evidence_level": null,
      "amount_ratio_20d": 3.2194798591535334,
      "amount_percentile_120d": 100.0,
      "pullback_volume_ratio": null,
      "breakout_type": "BREAKOUT_250D",
      "breakout_hold_days": 1,
      "weekly_breakout_type": "WEEK_BREAKOUT_52W",
      "capacity_confirmation": null,
      "risk_flags": [],
      "why_selected": [
        "当日成交额为此前20日均值的3.22倍",
        "收盘价形成BREAKOUT_250D，站稳天数1",
        "周线形成WEEK_BREAKOUT_52W"
      ]
    },
    {
      "ts_code": "600802.SH",
      "stock_name": "福建水泥",
      "industry": "水泥",
      "themes": [
        "水泥"
      ],
      "trend_inflection_score": 41,
      "fundamental_inflection_score": 0,
      "price_volume_score": 18,
      "daily_structure_score": 12,
      "weekly_trend_score": 3,
      "chip_structure_score": 8,
      "status": "INFLECTION_WATCH",
      "previous_status": "NO_SIGNAL",
      "score_change_1d": 29.0,
      "score_change_5d": null,
      "main_catalyst": null,
      "catalyst_stage": null,
      "evidence_level": null,
      "amount_ratio_20d": 4.548230046878101,
      "amount_percentile_120d": 95.83333333333334,
      "pullback_volume_ratio": null,
      "breakout_type": "BREAKOUT_60D",
      "breakout_hold_days": 1,
      "weekly_breakout_type": "WEEK_BREAKOUT_12W",
      "capacity_confirmation": null,
      "risk_flags": [],
      "why_selected": [
        "当日成交额为此前20日均值的4.55倍",
        "收盘价形成BREAKOUT_60D，站稳天数1",
        "周线形成WEEK_BREAKOUT_12W"
      ]
    },
    {
      "ts_code": "600616.SH",
      "stock_name": "金枫酒业",
      "industry": "非白酒",
      "themes": [
        "非白酒"
      ],
      "trend_inflection_score": 41,
      "fundamental_inflection_score": 0,
      "price_volume_score": 18,
      "daily_structure_score": 12,
      "weekly_trend_score": 3,
      "chip_structure_score": 8,
      "status": "INFLECTION_WATCH",
      "previous_status": "NO_SIGNAL",
      "score_change_1d": 28.0,
      "score_change_5d": null,
      "main_catalyst": null,
      "catalyst_stage": null,
      "evidence_level": null,
      "amount_ratio_20d": 5.640326206622743,
      "amount_percentile_120d": 100.0,
      "pullback_volume_ratio": null,
      "breakout_type": "BREAKOUT_60D",
      "breakout_hold_days": 1,
      "weekly_breakout_type": "WEEK_BREAKOUT_12W",
      "capacity_confirmation": null,
      "risk_flags": [],
      "why_selected": [
        "当日成交额为此前20日均值的5.64倍",
        "收盘价形成BREAKOUT_60D，站稳天数1",
        "周线形成WEEK_BREAKOUT_12W"
      ]
    },
    {
      "ts_code": "002832.SZ",
      "stock_name": "比音勒芬",
      "industry": "服饰",
      "themes": [],
      "trend_inflection_score": 43,
      "fundamental_inflection_score": 0,
      "price_volume_score": 9,
      "daily_structure_score": 13,
      "weekly_trend_score": 15,
      "chip_structure_score": 6,
      "status": "INFLECTION_WATCH",
      "previous_status": "NO_SIGNAL",
      "score_change_1d": 27.0,
      "score_change_5d": null,
      "main_catalyst": null,
      "catalyst_stage": null,
      "evidence_level": null,
      "amount_ratio_20d": 1.2402417926209925,
      "amount_percentile_120d": 79.16666666666666,
      "pullback_volume_ratio": null,
      "breakout_type": "BREAKOUT_250D",